{
  "name": "Lunessa Red Yeast Rice + CoQ10 Gummies",
  "slug": "red-yeast-rice-coq10-gummies",
  "brand_slug": "lunessa",
  "category": "Heart health supplement (gummies)",
  "positioning": null,
  "price": null,
  "identity_block": "Container: Clear plastic bottle, cylindrical, white screw-top lid\nLabel: Deep burgundy/maroon background with white \"Lunessa\" wordmark at top (elegant serif font)\nSublabel: \"RED YEAST RICE + CoQ10\" in large white text\nClaims on label: Checkmarks for \"Cardiovascular\", \"Heart\", \"Cholesterol\", \"SUGAR FREE\", \"RASPBERRY FLAVOR\"\nVisual element on label: Red yeast rice ingredient cluster at bottom of label\nGummies: Red/ruby colored, visible through clear bottle\nOverall palette: Deep burgundy/maroon, white, red — warm clinical authority aesthetic\nCount: 60 vegan gummies per bottle",
  "mechanism_block": null,
  "extra_blocks": [],
  "colorways": [],
  "dimensions": {
    "count": "60 vegan gummies per bottle"
  },
  "materials": [
    "plastic"
  ],
  "banned_terms": [],
  "required_phrases": [],
  "claims": [
    {
      "claim": "Cardiovascular",
      "verified": true,
      "source": "/Users/brooksorradre2/.claude/skills/lunessa/SKILL.md#L24"
    },
    {
      "claim": "Heart",
      "verified": true,
      "source": "/Users/brooksorradre2/.claude/skills/lunessa/SKILL.md#L24"
    },
    {
      "claim": "Cholesterol",
      "verified": true,
      "source": "/Users/brooksorradre2/.claude/skills/lunessa/SKILL.md#L24"
    },
    {
      "claim": "SUGAR FREE",
      "verified": true,
      "source": "/Users/brooksorradre2/.claude/skills/lunessa/SKILL.md#L24"
    },
    {
      "claim": "RASPBERRY FLAVOR",
      "verified": true,
      "source": "/Users/brooksorradre2/.claude/skills/lunessa/SKILL.md#L24"
    }
  ],
  "engine_notes": [],
  "reference_assets": [
    {
      "role": "master_seed",
      "asset_id": null,
      "source_path_original": "~/Documents/marketing brain/lunessa/website assets/lunessa spelling corrected .jpg",
      "note": "Hero product shot — single bottle, front-facing (PRIMARY)",
      "colorway": null
    },
    {
      "role": "angle",
      "asset_id": null,
      "source_path_original": "~/Documents/marketing brain/lunessa/website assets/triple bottles.png",
      "note": "Three bottles arranged — hero bundle shot",
      "colorway": null
    },
    {
      "role": "angle",
      "asset_id": null,
      "source_path_original": "~/Documents/marketing brain/lunessa/website assets/lunessa bottles.png",
      "note": "Multiple bottles arrangement",
      "colorway": null
    },
    {
      "role": "angle",
      "asset_id": null,
      "source_path_original": "~/Documents/marketing brain/lunessa/website assets/single bottle .jpg",
      "note": "Single bottle, clean shot",
      "colorway": null
    },
    {
      "role": "lifestyle",
      "asset_id": null,
      "source_path_original": "~/Documents/marketing brain/lunessa/website assets/hand with bottle transparent.png",
      "note": "Hand holding bottle, transparent background",
      "colorway": null
    },
    {
      "role": "detail",
      "asset_id": null,
      "source_path_original": "~/Documents/marketing brain/lunessa/website assets/gummy Medium.jpeg",
      "note": "Individual gummy close-up",
      "colorway": null
    },
    {
      "role": "detail",
      "asset_id": null,
      "source_path_original": "~/Documents/marketing brain/lunessa/website assets/gummy.jpeg",
      "note": "Gummy close-up alternate",
      "colorway": null
    },
    {
      "role": "detail",
      "asset_id": null,
      "source_path_original": "~/Documents/marketing brain/lunessa/website assets/gummy bear Background Removed.png",
      "note": "Gummy with background removed",
      "colorway": null
    },
    {
      "role": "lifestyle",
      "asset_id": null,
      "source_path_original": "~/Documents/marketing brain/lunessa/website assets/gummies in hand (corrected).jpg",
      "note": "Lifestyle — gummies in hand",
      "colorway": null
    },
    {
      "role": "lifestyle",
      "asset_id": null,
      "source_path_original": "~/Documents/marketing brain/lunessa/website assets/woman with gummies.jpg",
      "note": "Lifestyle — woman holding gummies",
      "colorway": null
    },
    {
      "role": "angle",
      "asset_id": null,
      "source_path_original": "~/Documents/marketing brain/lunessa/website assets/hero img Medium.jpeg",
      "note": "Hero image, medium resolution",
      "colorway": null
    },
    {
      "role": "angle",
      "asset_id": null,
      "source_path_original": "~/Documents/marketing brain/lunessa/website assets/hero img.jpeg",
      "note": "Hero image",
      "colorway": null
    },
    {
      "role": "angle",
      "asset_id": null,
      "source_path_original": "~/Documents/marketing brain/lunessa/website assets/removed bg.png",
      "note": "Product with background removed",
      "colorway": null
    }
  ],
  "qa_checklist": [],
  "version": 1,
  "extracted_from": {
    "path": "/Users/brooksorradre2/.claude/skills/lunessa/SKILL.md",
    "sha256": "d7ed91154be355afb400cd6df7a107377616f51818e904cc0d761e2cf4c55876",
    "extracted_at": "2026-09-03T00:05:43+00:00",
    "extractor": "scripts/extract_product_truth.py"
  },
  "extraction": {
    "confidence": {
      "name": "high",
      "identity_block": "low",
      "mechanism_block": "none",
      "extra_blocks": "none",
      "colorways": "none",
      "dimensions": "medium",
      "materials": "low",
      "banned_terms": "none",
      "required_phrases": "none",
      "claims": "medium",
      "engine_notes": "none",
      "reference_assets": "medium",
      "qa_checklist": "none"
    },
    "notes": [
      "no VERBATIM IDENTITY BLOCK; identity_block assembled from Visual Description bullets",
      "no MECHANISM/FLAP/OPENING block found; mechanism_block=null"
    ]
  }
}
