{
  "name": "Velantra Straw Tote",
  "slug": "straw-tote",
  "brand_slug": "velantra",
  "category": "tote bag",
  "positioning": null,
  "price": null,
  "identity_block": "a structured hand woven straw tote in warm sandy caramel, tightly woven straw body with braided cross stitch trim along the edges, a smooth taupe leather flap folded over the top of the bag from the back: the flap is ONE single seamless piece of leather, its front lower edge cut into the silhouette of a wide center panel with 2 squared outer tabs, the leather fully continuous and unbroken between and above these shapes, with exactly 2 narrow slots through which the handles pass, two rolled taupe leather top handles, two taupe leather belt straps crossed on the front, white contrast stitching on all leather edges, no metal hardware, no logos. The leather flap, tabs and belt straps exist ONLY on the FRONT face of the bag, the back face is plain woven straw, no duplicated front detailing on any other face.",
  "mechanism_block": "Flap and opening construction: the taupe leather flap is ONE single seamless sheet of leather attached along the top rear edge of the tote and folded all the way forward over the front, lying completely flat. Its front lower edge is cut into the shape of a wide center panel and 2 squared outer tabs, but these are shapes cut into the SAME single sheet, never separate pieces. The leather is continuous and unbroken between the shapes and across the entire top of the bag, including between the two handle slots. The only openings anywhere in the flap are the 2 narrow handle slots. No gap, no seam, no split, no opening exists anywhere else in the flap, and nothing behind or inside the bag is ever visible through the flap. The flap never splits into pieces, never lifts, never stands up, always folded all the way over. When the tote is carrying things, the woven mouth opens BEHIND the flap: the croissant, baguette or flowers lean out of the open mouth at the back of the bag, behind the leather flap, never through the flap. The 2 taupe leather belt straps lie crossed in an X over the front below the flap with rounded ends and white contrast stitching, exactly as on the closed reference bag, never threaded through the flap and never wrapped around the contents. No metal hardware anywhere on the bag.",
  "extra_blocks": [],
  "colorways": [
    {
      "name": "Caramel",
      "description": "hero",
      "hero": true
    },
    {
      "name": "Sky-Blue",
      "description": ""
    },
    {
      "name": "Caban-Black",
      "description": ""
    }
  ],
  "dimensions": {},
  "materials": [
    "leather",
    "straw",
    "woven"
  ],
  "banned_terms": [
    {
      "term": "Strato",
      "reason": "- Naming (2026-07-18, Brooks): always \"Straw Tote\". The registry key strato in velantra-ugc products.json still resolves, but \"Strato\" never appears in briefs, concepts, or customer-facing copy.",
      "scope": "copy"
    },
    {
      "term": "Birkin",
      "reason": "- Claims: OK — hand woven, structured/holds its shape, leather flap + handle detailing, fits a full day of stuff, seasonal colorways, limited quantities. BANNED — any origin claim, \"Birkin\"/\"Hermes\" spoken or on screen, ",
      "scope": "any"
    },
    {
      "term": "Hermes",
      "reason": "- Claims: OK — hand woven, structured/holds its shape, leather flap + handle detailing, fits a full day of stuff, seasonal colorways, limited quantities. BANNED — any origin claim, \"Birkin\"/\"Hermes\" spoken or on screen, ",
      "scope": "any"
    },
    {
      "term": "N elements/sections/pieces",
      "reason": "LANGUAGE LESSON (root cause of the second failure round): the original blocks said \"exactly 3 leather elements / 3 sections joined at the top\" — generators LITERALIZED this into three separate applied pieces with visible",
      "scope": "any"
    }
  ],
  "required_phrases": [
    "every color matches the first reference image exactly",
    "shapes cut into one sheet"
  ],
  "claims": [
    {
      "claim": "hand woven",
      "verified": true,
      "source": "/Users/brooksorradre2/.claude/skills/velantra-straw-tote/SKILL.md#L20"
    },
    {
      "claim": "structured/holds its shape",
      "verified": true,
      "source": "/Users/brooksorradre2/.claude/skills/velantra-straw-tote/SKILL.md#L20"
    },
    {
      "claim": "leather flap + handle detailing",
      "verified": true,
      "source": "/Users/brooksorradre2/.claude/skills/velantra-straw-tote/SKILL.md#L20"
    },
    {
      "claim": "fits a full day of stuff",
      "verified": true,
      "source": "/Users/brooksorradre2/.claude/skills/velantra-straw-tote/SKILL.md#L20"
    },
    {
      "claim": "seasonal colorways",
      "verified": true,
      "source": "/Users/brooksorradre2/.claude/skills/velantra-straw-tote/SKILL.md#L20"
    },
    {
      "claim": "limited quantities",
      "verified": true,
      "source": "/Users/brooksorradre2/.claude/skills/velantra-straw-tote/SKILL.md#L20"
    }
  ],
  "engine_notes": [
    {
      "engine": "GPT Image 2 i2i (kie.ai gpt-image-2-image-to-image)",
      "note": "the product-shot path (per feedback_product_shots_i2i, never Nano Banana). Wire caramel 1.png as ref; identity + mechanism blocks in the prompt. Mechanism block required even in stills whenever contents are visible in the bag."
    },
    {
      "engine": "Seedance 2.0 (kie.ai)",
      "note": "wire the colorway ref as @Image2 in ref-mode (velantra-ugc), or bake identity into the first frame in chain-mode; video mechanism pin required in every prompt where the bag is in frame with contents."
    },
    {
      "engine": "Claymation brand films",
      "note": "the bag renders as the ONLY photorealistic object in the clay world (campaign law, see claymation-brand-films-2026-07/_campaign/style-bible.md)."
    },
    {
      "engine": "general",
      "note": "No em dashes/ellipses in prompts, no \"Birkin\", no origin claims (kie runner claims-grep hard-fails)."
    }
  ],
  "reference_assets": [
    {
      "role": "master_seed",
      "asset_id": null,
      "source_path_original": "brands/velantra/products/straw-birkin/product-images/straw birkin/caramel 1.png",
      "note": "Hero — front-on, caramel weave, flap + crossed belts. Default identity ref",
      "colorway": null
    },
    {
      "role": "angle",
      "asset_id": null,
      "source_path_original": "brands/velantra/products/straw-birkin/product-images/straw birkin/blue 1.png",
      "note": "Sky-blue colorway",
      "colorway": null
    },
    {
      "role": "angle",
      "asset_id": null,
      "source_path_original": "brands/velantra/products/straw-birkin/product-images/straw birkin/straw tote 1.webp",
      "note": "Alternate classic shot",
      "colorway": null
    }
  ],
  "qa_checklist": [
    "CORRECT = one connected 3-section flap lying flat over the front, contents leaning out of the mouth behind it, 2 belts crossed in an X below it, no metal.",
    "FAIL (regenerate on sight) = flap split in half / separate floating tabs / gap between sections; flap half-open, lifted, or standing up; anything poking through or between the flap sections; belts threaded through the flap or wrapped around contents; section count ≠ 3; belt count ≠ 2; any metal hard",
    "Spawn a fresh-context subagent (Agent tool, general-purpose) whose ONLY job is to audit the frame. Fresh eyes — never the context that wrote the prompt.",
    "The subagent Reads: the QA checklist (brands/velantra/_shared/creative/claymation-brand-films-2026-07/_campaign/qa-checklists.md — campaign-agnostic checklists live there), the canonical product reference image, and the generated frame(s).",
    "For VIDEO segments: extract ≥3 frames spread across the clip (ffmpeg, start/middle/end) and audit each — Seedance breaks mechanisms mid-motion even from a clean first frame.",
    "The subagent returns a structured verdict per frame: PASS or FAIL + specific reasons keyed to the checklist.",
    "FAIL → regenerate with the mechanism block pasted, then re-audit. Cap 3 attempts; if still failing, change the blocking (composition) per the blocking-escalation law and/or escalate to Brooks.",
    "⛔ PRE-ANIMATION GATE (Brooks, 2026-07-18): the audit happens BEFORE the frame is animated — artifacted source images are the root cause of most video artifacts. Audit the exact crop that feeds the engine. Never animate, present, or stitch a frame that hasn't passed.",
    "Video audits also FAIL on INVENTED-DESIGN mutation: Seedance grows braided trim, metal buckles, saddle flaps, or wrap-around straps on the tote mid-motion (confirmed WOVEN film, 2026-07-18). Any hardware or geometry not on the canonical reference = regenerate."
  ],
  "version": 1,
  "extracted_from": {
    "path": "/Users/brooksorradre2/.claude/skills/velantra-straw-tote/SKILL.md",
    "sha256": "0cff2e09004b2bf2d8dd28cc97ddc9042c4a239ee85ac775da0ade6ac202d318",
    "extracted_at": "2026-09-03T00:05:43+00:00",
    "extractor": "scripts/extract_product_truth.py"
  },
  "extraction": {
    "confidence": {
      "category": "low",
      "name": "high",
      "identity_block": "high",
      "mechanism_block": "high",
      "extra_blocks": "none",
      "colorways": "medium",
      "dimensions": "none",
      "materials": "low",
      "banned_terms": "medium",
      "required_phrases": "low",
      "claims": "medium",
      "engine_notes": "medium",
      "reference_assets": "medium",
      "qa_checklist": "medium"
    },
    "notes": []
  }
}
